{
  "id": "card-agenda",
  "utterance": "example agenda",
  "status": "ready",
  "screen": {
    "title": "Agenda",
    "blocks": [
      {
        "id": "g1",
        "type": "agenda",
        "label": "Today",
        "items": [
          {
            "id": "m1",
            "time": "9:30",
            "title": "Standup"
          },
          {
            "id": "m2",
            "time": "11:00",
            "title": "Acme kickoff prep"
          },
          {
            "id": "m3",
            "time": "14:00",
            "meta": "Dana Park · Zoom", "state": "next",
            "title": "Investor call"
          }
        ]
      }
    ]
  }
}